{
  "dcp_version": "2.0",
  "agent_id": "agent:research-bot-v2-gen",
  "session_nonce": "a0f170f5da399c85fb454c1194b0650475d3b55e2068eaafe263cf4aa90630c8",
  "keys": [
    {
      "kid": "20f2dea0807f9f6ade0a22df19dc0402",
      "alg": "ed25519",
      "public_key_b64": "50s1mezKgIQJMd+WBlaaDCKwhYcz4qMl/m2poWxD1xI=",
      "created_at": "2026-10-22T05:33:24Z",
      "expires_at": "2027-10-22T05:33:24Z",
      "status": "active"
    },
    {
      "kid": "6edf5c609380b7feea515584e42322f7",
      "alg": "ml-dsa-65",
      "public_key_b64": "dR7/S/RgYnKcd9mipptz4NFF8cIYcMuynOUoNwYJ2nZa3lV6fg2jKk7sgVaZ6TzqbL/Zme+1KzPRmhWyy4iRe3HwN8+/9cmaJvbD3VcghWEkguRIYVYl4GzcB1L+gnWam00QDbMFkbJdfC0D4TrRzlQe21L0cOpKIPmjrfiJMTS/dY7NXHcc6rkqb2MXfMwlA0pDGFbHvdLfOsKFgFJWbJJgonvrZoSfictUCEcLkf1hPOcSOrQznRjkDPLrzD2eqQ6F2TTE23uADZz+zobR/NQWJHWFb9Wl0VJFtIUuOgPoQtltAIQUd4e+jnV+9HM0zMZ/de0L4HU+Mtou3XspezpG6DHH9Qo9M+PpnS7KNoYoQXQmDE9EqVHtTscD8qFBNWOSdY7dx5Tw0XlgEm6l2eDAUiA+cNIcExeuhB52p7RN7oydFOA9YOQ7a1ESveHoHrQc6QKRRZ2281q3G/mjqKtyFqEhunLLc4xfYv2REK0lEPpEHV8KWJhZz3h6ZL5M0S5J6VUVvWb75CWMw/exg8KTnTG3LX9aj1CyaNq1eqQL43bvz0/zDCkV+DnsLbtrddochKXV81VuL815hp+bYpA8H31VA72Rs8htcDys+djAL4Eq0T+ZhI0GI1TFQfkBekYTdYVNGwHkpMNL4XWjx06EMzKTITBw6b8mIzkJ7N99ot8R5XgW/eq1Bdg2zEyPrR2Z1c94aaahbNWgzWvNS6tatxVDLpmT4CrC03gFO9He7iqhcL+YBBxQDNOfg5w87rypiGdhWKee902T/lgK64Ov+DnmpM5kOwfMzdAeO/N/3Dfatdp8V7S2bR1mJ60sITIvKMu+7tR/EAkwNmyVZXnFlk1ka4i4GWAVWH8aYpJyMZT6DKUm7zV/R4rgmiNNylS18wTGeQnE6pIEizbNNhyNsSLBUbqeJj5eFS5hL/pMumfoekwudRT7ctX1hvDHFYofomt8yhCvgg3PHueHa6GSeZa1Zp+I5BY1SEi58Ul4VeKCj6WaAlVo1zJ3v8zOVFmo2pLDQ2yTofQc7l6Z8Jc9Z9H+uHsyqn2SM5CN9uTPFlO3z4j5df1ng1N5uN5gK5PKtWB60XLOXu/3H1pUF4Quucnp8KWFLO9MMFstPuQp//p918F4aHgCwzrsYsgBH0G31olK4l09t8hMIBnn4z4oanrXUahRgPwZpO/btgqsg+j0VD6tOSX7P0S/IZAgCNw2b7DYmJPMEXZvr4UvvGyvyux9EWvb0mtJ8qgOXmAZrizVv6kOYhuOe8ENBPyviOkHiJiQ9VILFtdV9CLO0Y82RfLfhfaGESqCoIkB025frgRxC678dWc5WTnEDoo0S7hFWcTvQ3k4lTQrCx0gFSOCOdNTCxByrzl86xPyvKOHIzgk48nremHI9oVmlLJ8dKDn8D9/ASeA4KIIqkCragEChXAYKiaXg+SE7MQtjKTjAneO9x3QiZDdeWshMBjnFtFG+4JonaDPJ+7lacyJ54hnM1MX3comS+gm6mfQsMQrB7QT8n/5l+GeTsXRSS9zz6GiK8JaDiCzK90kWOwsdJNoH9ZM1mhrM8RLJb2AznqXyw2Of4ivyr8tl0HxO+gYFwVUukQOuRKcXfmCpp9ykmZi3BWMDBUs0O/lOHSAQ9PlKACmDW2IHoRSgDjqLZABH/oAUchXtrkMxEGJvFlh/XYJihUrMsTQkRqxlgN5EYnexvOBQx4D5alcWttXkNexbkoGe4KpoVZZ/y+imlTn3GA55QII8q4WQK1Wx9Lrqu9aETDQ78sp8TfdIP0sr95imbHxEMcr9mC0YJ60Uw+iAFs9WbpUdoiSbi/GokCcwtaMe2CKqTBDEE4qUHozyuZp8QoQFkAWfjmW1xMmVYLlXzvfbgduO8045NJEa08ZO2rRpThSQGx7IqGpzD6gK0VDjZEtAPKln8TDVMqzpUDSb44MqV9U/6qoqcKPjULPQNImj2faW99rv0GNlb6ri4UUIw+M2nel5WOUWNwsUK0C7qDSHFs72jOv7nYNgWUvugAydLp4d+2LHs9nohdYFpqpJeVAA9cy5ic/7GB7vWDxBcf1hc50izSCHKPOZ6b+jbNLOavrsJY31aiCUAadRfOk14N+/cZxOo2hCWw7tn8DyHknD2wgzlQKDvW0bePqCPC4JpnetxUErYmnAwuhs4YY2AJxsz+KBuWitdDjLFbjduM+1rRtQkwHBH5aoWSuz/8QzKWw7pXaYW65x8rEkPdjN0PS1mYl92TV/30+hwIvCrBD/SIo5/Wg3r8ZJm8y6TC/3sO5CVIDjMY5OsxJ8stFtkpP5d4xVhDbFR5+x1CTHCG6hpTZ2QnNzKtV3J2WJbMufeQUD6MAbzAU7hk6/4qKMwKKXZ45ijRNOWWYZbCwqArh5zNIEfJkJyopPFKg0YNlBn41aelO/fSYlaSQmr+1QrztEOH2fql3XqFdlLCkrbYVNedJcdd9qkmUP/Wc2MRUPbUtZqtt4n7+7zxwQsHpZbrhUFXZe8IYhgZTF5vkrwUXXzEkCoersp4ELSL19B4HpqcwHTHaDkguMWWz1GHEvl7RapRFBgshV9b3U6x+MHdwUUr24cnJ4Wyufy1IRxA=",
      "created_at": "2026-10-22T05:33:24Z",
      "expires_at": "2027-10-22T05:33:24Z",
      "status": "active"
    }
  ],
  "principal_binding_reference": "rpr:v2-example-001",
  "capabilities": [
    "browse",
    "api_call"
  ],
  "risk_tier": "medium",
  "created_at": "2026-10-22T05:33:24Z",
  "status": "active",
  "emergency_revocation_token": "sha256:8d0ea73fbe1ee9140c61726baee5049fd75697638a5bb542bddf3a53bab32a86"
}